{
  "files": {
    "colors_and_type.css": {
      "sha256": "de2ada38130052ada5c80a98a56331c626b229149dbeeff00854d32b8056e653",
      "text": "/*\n * maude-v2 — design tokens · \"Light glass with a spark\"\n *\n * Authoritative token file for the Maude v2.0.0 redesign (designer-first, light,\n * floating chrome over a full-window canvas). Every canvas built with --ds=maude-v2\n * and every preview/<slug>.tsx specimen links to this file through _layout.css.\n *\n * Locked direction (Stage-3 moodboard, ui/v2/maude-v2-moodboard.tsx → artboard\n * \"direction-mix\"): Mac-native frosted islands (macOS Liquid Glass × Craft × Framer)\n * plus a touch of the playful workshop (FigJam × Kinopio): colour lives ON the\n * canvas, the dock is rounder, and a warm spark is reserved for AI moments only.\n *\n * Roles — one token, one job:\n *   --accent*   azure — primary action, current selection, focus. Functional only.\n *   --spark*    vermilion — the AI (agent cursor, \"Ask AI\" send, AI-made badges). Never decoration, never error.\n *   --object-*  the canvas object palette (stickies, shapes, canvas colour chips). Lives on the canvas, not in chrome.\n *   --island-*  the frosted floating-chrome material (panels, dock, menus).\n *\n * Themes: light is the default (it follows macOS appearance in the app); dark is an\n * equal-status counterpart. Every family token is declared in BOTH blocks.\n * No contrast ratios are asserted in this file — pairs are verified by the a11y pass.\n */\n\n:root,\n.maude-v2[data-theme=\"light\"],\n.ds[data-theme=\"light\"] {\n  color-scheme: light;\n\n  /* ─── Surfaces (deepest → highest) ─────────────────────────────────── */\n  --bg-0: oklch(0.978 0.005 240);   /* the canvas / page                     */\n  --bg-1: oklch(0.995 0.002 240);   /* island / panel body                   */\n  --bg-2: oklch(1 0 0);             /* popover, menu, sheet                  */\n  --bg-3: oklch(0.958 0.006 240);   /* input well, row hover                 */\n  --bg-4: oklch(0.928 0.008 240);   /* pressed, selected-row-without-accent  */\n\n  /* ─── Borders (alpha of ink, so they sit on any surface) ───────────── */\n  --border-subtle:  oklch(0.24 0.014 250 / 0.07);\n  --border-default: oklch(0.24 0.014 250 / 0.12);\n  --border-strong:  oklch(0.24 0.014 250 / 0.24);\n\n  /* ─── Text ─────────────────────────────────────────────────────────── */\n  --fg-0: oklch(0.24 0.014 250);    /* primary          */\n  --fg-1: oklch(0.42 0.012 250);    /* secondary        */\n  --fg-2: oklch(0.505 0.010 250);   /* tertiary / meta — holds on --bg-3/--bg-4 */\n  --fg-3: oklch(0.70 0.008 250);    /* disabled         */\n\n  /* ─── Accent — single azure, functional only ──────────────────────── */\n  --accent:        oklch(0.53 0.175 238);           /* white text on it ≈ 4.9:1 (computed) */\n  --accent-hover:  oklch(0.49 0.170 238);\n  --accent-active: oklch(0.46 0.165 238);\n  --accent-fg:     oklch(1 0 0);\n  --focus-ring:    var(--accent);                   /* keyboard focus outline */\n  --accent-text:   oklch(0.47 0.170 238);           /* azure used AS TEXT on light surfaces — ≥4.7:1 even on --accent-muted over bg-3 */\n  --accent-soft:  oklch(0.53 0.175 238 / 0.12);\n  --accent-muted: var(--accent-soft);   /* selected row, chip bg   */\n  --selection:   oklch(0.53 0.175 238 / 0.22);\n  --accent-tint: var(--selection);   /* text selection, rings   */\n\n  /* ─── Spark — the AI's colour (reserved role, not a second accent) ─── */\n  --x-spark:        oklch(0.66 0.200 36);\n  --spark: var(--x-spark);\n  --x-spark-hover:  oklch(0.70 0.190 38);\n  --spark-hover: var(--x-spark-hover);\n  --x-spark-fg:     oklch(0.20 0.030 36);\n  --spark-fg: var(--x-spark-fg);            /* dark ink on the spark — keeps it bright and far from error red */\n  --x-spark-text:   oklch(0.50 0.170 36);\n  --spark-text: var(--x-spark-text);            /* spark used AS TEXT on light surfaces */\n  --x-spark-muted:  oklch(0.66 0.200 36 / 0.12);\n  --spark-muted: var(--x-spark-muted);\n\n  /* ─── Status ───────────────────────────────────────────────────────── */\n  --status-success: oklch(0.60 0.140 152);\n  --status-warn:    oklch(0.72 0.150 78);\n  --status-error:   oklch(0.55 0.190 22);\n  --status-info:    oklch(0.60 0.140 250);\n  --status-success-text: oklch(0.52 0.130 152);    /* status colours used AS TEXT */\n  --status-warn-text:    oklch(0.54 0.120 70);\n  --status-error-text:   oklch(0.52 0.190 22);\n  --status-info-text:    oklch(0.535 0.130 250);\n\n  /* ─── Controls ─────────────────────────────────────────────────────── */\n  --x-control-off: oklch(0.64 0.010 250);\n  --control-off: var(--x-control-off);            /* switch track / unchecked box edge */\n\n  /* ─── Presence (people + the agent) ────────────────────────────────── */\n  --presence-online:  oklch(0.66 0.150 152);\n  --presence-away:    oklch(0.76 0.140 80);\n  --presence-offline: oklch(0.72 0.008 250);\n  --x-presence-agent:   var(--spark);\n  --presence-agent: var(--x-presence-agent);\n\n  /* ─── Canvas object palette — colour lives on the canvas ───────────── */\n  --palette-1: oklch(0.91 0.120 95);\n  --object-yellow: var(--palette-1);\n  --palette-2:  oklch(0.82 0.120 152);\n  --object-green: var(--palette-2);\n  --palette-3:  oklch(0.83 0.075 300);\n  --object-lilac: var(--palette-3);\n  --palette-4:  oklch(0.83 0.095 32);\n  --object-coral: var(--palette-4);\n  --palette-5:    oklch(0.85 0.070 230);\n  --object-sky: var(--palette-5);\n  --palette-6:   oklch(0.90 0.006 250);\n  --object-grey: var(--palette-6);\n  --palette-ink:    oklch(0.24 0.014 250);\n  --object-ink: var(--palette-ink);           /* text on any sticky */\n\n  /* ─── Canvas ───────────────────────────────────────────────────────── */\n  --x-canvas-bg:   var(--bg-0);\n  --canvas-bg: var(--x-canvas-bg);\n  --x-canvas-dot:  oklch(0.80 0.010 240);\n  --canvas-dot: var(--x-canvas-dot);\n  --x-canvas-grid: 20px;\n  --canvas-grid: var(--x-canvas-grid);\n\n  /* ─── Island — the floating-chrome material (signature) ───────────── */\n  --x-island-bg:     oklch(0.995 0.002 240 / 0.88);\n  --island-bg: var(--x-island-bg);   /* ~88% opaque: frost, never peek-through */\n  --x-island-bg-strong: oklch(0.995 0.002 240 / 0.96);\n  --island-bg-strong: var(--x-island-bg-strong); /* large islands over busy canvas: inspector, AI chat panel */\n  --x-island-blur:   16px;\n  --island-blur: var(--x-island-blur);\n  --x-island-edge:   oklch(0.24 0.014 250 / 0.10);\n  --island-edge: var(--x-island-edge);    /* 0.5px inner hairline   */\n  --x-island-shadow: 0 2px 10px oklch(0.24 0.030 250 / 0.07), 0 0.5px 1.5px oklch(0.24 0.030 250 / 0.06);\n  --island-shadow: var(--x-island-shadow);\n\n  /* ─── Shadows / elevation (soft) ───────────────────────────────────── */\n  --shadow-sm: 0 1px 2px oklch(0.24 0.030 250 / 0.08);\n  --shadow-md: 0 3px 10px oklch(0.24 0.030 250 / 0.08), 0 1px 2px oklch(0.24 0.030 250 / 0.05);\n  --shadow-lg: 0 8px 24px oklch(0.24 0.030 250 / 0.11), 0 2px 4px oklch(0.24 0.030 250 / 0.06);\n\n  /* ─── Schema v1 roles (V2-2.15 bring-up) ─── */\n  --accent-on-soft: var(--accent-text); /* azure as text on the soft tint */\n  --scrim: color-mix(in oklch, var(--fg-0) 40%, transparent); /* modal backdrop */\n  --status-success-fg: var(--accent-fg); /* text on the fill */\n  --status-warn-fg: var(--fg-0); /* text on the fill */\n  --status-error-fg: var(--accent-fg); /* text on the fill */\n  --status-info-fg: var(--accent-fg); /* text on the fill */\n  --status-success-soft: color-mix(in oklch, var(--status-success) 12%, transparent); /* tint, same alpha as --accent-soft */\n  --status-warn-soft: color-mix(in oklch, var(--status-warn) 12%, transparent); /* tint, same alpha as --accent-soft */\n  --status-error-soft: color-mix(in oklch, var(--status-error) 12%, transparent); /* tint, same alpha as --accent-soft */\n  --status-info-soft: color-mix(in oklch, var(--status-info) 12%, transparent); /* tint, same alpha as --accent-soft */\n}\n\n.maude-v2[data-theme=\"dark\"],\n.ds[data-theme=\"dark\"] {\n  color-scheme: dark;\n\n  /* ─── Surfaces ─────────────────────────────────────────────────────── */\n  --bg-0: oklch(0.205 0.006 250);\n  --bg-1: oklch(0.245 0.007 250);\n  --bg-2: oklch(0.275 0.008 250);\n  --bg-3: oklch(0.300 0.008 250);\n  --bg-4: oklch(0.340 0.009 250);\n\n  /* ─── Borders ──────────────────────────────────────────────────────── */\n  --border-subtle:  oklch(1 0 0 / 0.06);\n  --border-default: oklch(1 0 0 / 0.11);\n  --border-strong:  oklch(1 0 0 / 0.20);\n\n  /* ─── Text ─────────────────────────────────────────────────────────── */\n  --fg-0: oklch(0.965 0.004 250);\n  --fg-1: oklch(0.800 0.006 250);\n  --fg-2: oklch(0.720 0.008 250);\n  --fg-3: oklch(0.500 0.008 250);\n\n  /* ─── Accent ───────────────────────────────────────────────────────── */\n  --accent:        oklch(0.54 0.165 238);           /* white text on it ≈ 4.7:1 (computed) */\n  --accent-hover:  oklch(0.50 0.160 238);\n  --accent-active: oklch(0.47 0.155 238);\n  --accent-fg:     oklch(1 0 0);\n  --focus-ring:    oklch(0.72 0.140 238);           /* dark accent is too deep for a 3:1 outline on bg-3/bg-4 — computed 5.6 / 4.8 */\n  --accent-text:   oklch(0.72 0.140 238);           /* azure used AS TEXT on dark surfaces */\n  --accent-soft:  oklch(0.64 0.165 238 / 0.18);\n  --accent-muted: var(--accent-soft);\n  --selection:   oklch(0.64 0.165 238 / 0.30);\n  --accent-tint: var(--selection);\n\n  /* ─── Spark ────────────────────────────────────────────────────────── */\n  --x-spark:        oklch(0.70 0.185 38);\n  --spark: var(--x-spark);\n  --x-spark-hover:  oklch(0.74 0.180 38);\n  --spark-hover: var(--x-spark-hover);\n  --x-spark-fg:     oklch(0.20 0.030 38);\n  --spark-fg: var(--x-spark-fg);\n  --x-spark-text:   oklch(0.74 0.150 38);\n  --spark-text: var(--x-spark-text);\n  --x-spark-muted:  oklch(0.70 0.185 38 / 0.18);\n  --spark-muted: var(--x-spark-muted);\n\n  /* ─── Status ─────────────────────────────────────────────